{"data":{"adapter":{"adapter_id":"synthetic.structured.v0","capabilities":["extract_import"],"digest":"2222222222222222222222222222222222222222222222222222222222222222","version":"0.1.0"},"branch_ids":["sid:v0:eyJsb2NhbGUiOiJlbiIsImxvZ2ljYWxfaWQiOlsic3ludGhldGljIiwic3RydWN0dXJlZCIsImNhcmdvX25vdGljZSJdLCJzZWxlY3Rvcl9wYXRoIjpbeyJuYW1lIjoidG9uZSIsInR5cGUiOiJzZWxlY3QiLCJ2YWx1ZSI6ImNhbG0ifSx7Im5hbWUiOiJjb3VudCIsInR5cGUiOiJwbHVyYWwiLCJ2YWx1ZSI6Im90aGVyIn1dfQ","sid:v0:eyJsb2NhbGUiOiJlbiIsImxvZ2ljYWxfaWQiOlsic3ludGhldGljIiwic3RydWN0dXJlZCIsImNhcmdvX25vdGljZSJdLCJzZWxlY3Rvcl9wYXRoIjpbeyJuYW1lIjoidG9uZSIsInR5cGUiOiJzZWxlY3QiLCJ2YWx1ZSI6ImNhbG0ifSx7Im5hbWUiOiJjb3VudCIsInR5cGUiOiJwbHVyYWwiLCJ2YWx1ZSI6Im9uZSJ9XX0","sid:v0:eyJsb2NhbGUiOiJlbiIsImxvZ2ljYWxfaWQiOlsic3ludGhldGljIiwic3RydWN0dXJlZCIsImNhcmdvX25vdGljZSJdLCJzZWxlY3Rvcl9wYXRoIjpbeyJuYW1lIjoidG9uZSIsInR5cGUiOiJzZWxlY3QiLCJ2YWx1ZSI6InNlY3JldCJ9LHsibmFtZSI6ImNvdW50IiwidHlwZSI6InBsdXJhbCIsInZhbHVlIjoib25lIn1dfQ","sid:v0:eyJsb2NhbGUiOiJlbiIsImxvZ2ljYWxfaWQiOlsic3ludGhldGljIiwic3RydWN0dXJlZCIsImNhcmdvX25vdGljZSJdLCJzZWxlY3Rvcl9wYXRoIjpbeyJuYW1lIjoidG9uZSIsInR5cGUiOiJzZWxlY3QiLCJ2YWx1ZSI6InNlY3JldCJ9LHsibmFtZSI6ImNvdW50IiwidHlwZSI6InBsdXJhbCIsInZhbHVlIjoib3RoZXIifV19","sid:v0:eyJsb2NhbGUiOiJlbiIsImxvZ2ljYWxfaWQiOlsic3ludGhldGljIiwic3RydWN0dXJlZCIsImNhcmdvX25vdGljZSJdLCJzZWxlY3Rvcl9wYXRoIjpbeyJuYW1lIjoidG9uZSIsInR5cGUiOiJzZWxlY3QiLCJ2YWx1ZSI6InVyZ2VudCJ9LHsibmFtZSI6ImNvdW50IiwidHlwZSI6InBsdXJhbCIsInZhbHVlIjoib25lIn1dfQ","sid:v0:eyJsb2NhbGUiOiJlbiIsImxvZ2ljYWxfaWQiOlsic3ludGhldGljIiwic3RydWN0dXJlZCIsImNhcmdvX25vdGljZSJdLCJzZWxlY3Rvcl9wYXRoIjpbeyJuYW1lIjoidG9uZSIsInR5cGUiOiJzZWxlY3QiLCJ2YWx1ZSI6InVyZ2VudCJ9LHsibmFtZSI6ImNvdW50IiwidHlwZSI6InBsdXJhbCIsInZhbHVlIjoib3RoZXIifV19"],"snapshot_id":"synthetic-structured-snapshot","source_locale":"en","source_raw_sha256":"1135c9714928f1f3d7a4513675a5d9dee73c54e25bdb6db0dec69413176c450b","source_version":"structured-demo-1"},"kind":"source_snapshot","schema_id":"urn:locpipe:contracts:v0:source-snapshot","schema_version":"0.1.0-draft.2"}
