{"data":{"adapter":{"adapter_id":"synthetic.flat.v0","capabilities":["extract_import"],"digest":"1111111111111111111111111111111111111111111111111111111111111111","version":"0.1.0"},"branch_ids":["sid:v0:eyJsb2NhbGUiOiJlbiIsImxvZ2ljYWxfaWQiOlsic3ludGhldGljIiwiZmxhdCIsImdyZWV0aW5nIl0sInNlbGVjdG9yX3BhdGgiOltdfQ","sid:v0:eyJsb2NhbGUiOiJlbiIsImxvZ2ljYWxfaWQiOlsic3ludGhldGljIiwiZmxhdCIsInN0YXR1cyJdLCJzZWxlY3Rvcl9wYXRoIjpbXX0","sid:v0:eyJsb2NhbGUiOiJlbiIsImxvZ2ljYWxfaWQiOlsic3ludGhldGljIiwiZmxhdCIsIndhcm5pbmciXSwic2VsZWN0b3JfcGF0aCI6W119"],"snapshot_id":"synthetic-flat-snapshot","source_locale":"en","source_raw_sha256":"171e16e17969845e055a5a59c09bb775643b3cf355ee5656d38245e2ec8cf0e8","source_version":"flat-demo-1"},"kind":"source_snapshot","schema_id":"urn:locpipe:contracts:v0:source-snapshot","schema_version":"0.1.0-draft.2"}
